{
  "$schema": "https://json-schema.org/draft/2020-12/schema",
  "$id": "openmathmodel.contracts.v1.approval-request",
  "title": "ApprovalRequest",
  "description": "人工确认（HIL）请求。人工确认是正式状态转换：审批解决后运行才能离开 WAITING_APPROVAL。",
  "type": "object",
  "properties": {
    "id": { "type": "string", "pattern": "^appr_[0-9a-f]{32}$" },
    "run_id": { "type": "string", "pattern": "^run_[0-9a-f]{32}$" },
    "step_id": {
      "oneOf": [
        { "type": "null" },
        { "type": "string", "pattern": "^step_[0-9a-f]{32}$" }
      ]
    },
    "decision_type": {
      "type": "string",
      "enum": ["confirm_plan", "confirm_method", "confirm_results", "generic"]
    },
    "title": { "type": "string", "minLength": 1, "maxLength": 500 },
    "description": { "type": ["string", "null"], "maxLength": 4000 },
    "options": {
      "type": "array",
      "minItems": 1,
      "items": {
        "type": "object",
        "properties": {
          "id": { "type": "string", "minLength": 1, "maxLength": 100 },
          "label": { "type": "string", "minLength": 1, "maxLength": 200 },
          "description": { "type": ["string", "null"], "maxLength": 1000 },
          "recommended": {
            "type": ["boolean", "null"],
            "description": "AI 推荐项标记：多正向选项的闸门（如 G2 数据闸门）用它声明默认选择；至多一个选项为 true，null/缺省等价于 false。"
          }
        },
        "required": ["id", "label"],
        "additionalProperties": false
      }
    },
    "evidence_snapshot_id": {
      "type": ["string", "null"],
      "maxLength": 200,
      "description": "审批所依据的证据快照引用；Evidence 体系落地前允许为空。"
    },
    "status": {
      "type": "string",
      "enum": ["PENDING", "RESOLVED", "EXPIRED", "CANCELLED"]
    },
    "resolution": {
      "oneOf": [
        { "type": "null" },
        {
          "type": "object",
          "properties": {
            "option_id": { "type": "string", "minLength": 1, "maxLength": 100 },
            "actor": { "type": "string", "minLength": 1, "maxLength": 200 },
            "comment": { "type": ["string", "null"], "maxLength": 2000 },
            "resolved_at": { "$ref": "#/$defs/timestamp" }
          },
          "required": ["option_id", "actor", "resolved_at"],
          "additionalProperties": false
        }
      ]
    },
    "expires_at": {
      "oneOf": [
        { "type": "null" },
        { "$ref": "#/$defs/timestamp" }
      ]
    },
    "created_at": { "$ref": "#/$defs/timestamp" }
  },
  "required": ["id", "run_id", "decision_type", "title", "options", "status", "created_at"],
  "additionalProperties": false,
  "$defs": {
    "timestamp": {
      "type": "string",
      "pattern": "^\\d{4}-\\d{2}-\\d{2}T\\d{2}:\\d{2}:\\d{2}(\\.\\d{1,6})?Z$",
      "description": "UTC ISO-8601，统一以 Z 结尾。"
    }
  }
}
